tweet_id,author_id,inbound,created_at,text,response_tweet_id,in_response_to_tweet_id
896308,AirAsiaSupport,FALSE,Sat Oct 21 07:14:47 +0000 2017,"@332864 Hi Ho, You are most welcome, Do let us know If any Further assistance is Needed. Thank you and have a Great day- Mich",,896306
896309,AirAsiaSupport,FALSE,Fri Oct 20 22:08:54 +0000 2017,"@332865 Cancellation is not allowed once the booking is confirmed as it's non-refundable, Mira. You can only do it during booking. -Miza",,896310
896311,AirAsiaSupport,FALSE,Fri Oct 20 09:43:53 +0000 2017,"@332865 Yes it's fine, Mira. You can always opt out for the baggage add-on during booking process too. Thanks. -Floi",896310,896312
896313,AirAsiaSupport,FALSE,Fri Oct 20 22:02:40 +0000 2017,"@332866 We have replied to your DM, Jay. Check it out! :) -Miza",896314,896315
896316,AirAsiaSupport,FALSE,Sat Oct 21 13:42:52 +0000 2017,@332866 We are glad that your concern has been resolved. We will take note on this and improve our services in near future - Khairul,,896314
896541,AirAsiaSupport,FALSE,Sat Nov 25 10:39:04 +0000 2017,@332927 Flight change is subject to CHANGE FEE(per person per way) + FARE DIFFERENCE. Click https://t.co/VyQJYYofA4 for Change Fee.,,896542
896543,AirAsiaSupport,FALSE,Sat Nov 25 10:16:54 +0000 2017,@332927 &gt;&gt; time via Manage My Booking up to 48 hours before departure. It will incur the fare difference and the change fee - Nod,896542,896544
896547,AirAsiaSupport,FALSE,Sat Nov 25 10:38:59 +0000 2017,@332928 Really sorry but route change is not allowed. Only flight change date/time is possible. Thank you - Ed,,896548
896549,AirAsiaSupport,FALSE,Sat Nov 25 10:36:34 +0000 2017,"@332929 Hi , this is an agent booking and the refund was processed and refunded to agent on 21/10/2005. D",,896550
896553,AirAsiaSupport,FALSE,Sat Nov 25 10:33:57 +0000 2017,@332930 &gt;&gt; Airport Tax sahaja yang boleh dikembalikan jika anda tidak menaiki penerbangan tersebut. Terima Kasih - Nod,,896554
896555,AirAsiaSupport,FALSE,Sat Nov 25 10:33:38 +0000 2017,"@332930 Hi Maniur, mohon maaf kerana tiada pembatalan ataupun refund yang boleh dilakukan selepas tempahan telah confirm. Hanya &gt;&gt;",,896554
896545,AirAsiaSupport,FALSE,Sat Nov 25 10:16:01 +0000 2017,"@332927 &gt;&gt; refundable if you did not board the flight. As for the flight change, you can make changes to your flight date and &gt;&gt;",,896544
896546,AirAsiaSupport,FALSE,Sat Nov 25 10:14:58 +0000 2017,"@332927 Hi Abishek , cancellation nor refund will not be allowed once the booking has been confirmed. Only the Airport Tax are &gt;&gt;",,896544
896556,AirAsiaSupport,FALSE,Sat Nov 25 10:14:06 +0000 2017,"@251646 Hi, title correction has already been made accordingly. Kindly refer to your email for the revised itinerary. Thanks - Ed",,896557
896777,AirAsiaSupport,FALSE,Sat Oct 21 03:11:18 +0000 2017,"@171002 Hi Jeena. we have replied you via DM,Thanks-Emir",896778,896779
896780,AirAsiaSupport,FALSE,Sat Oct 21 02:51:53 +0000 2017,"@171002 Sorry for the inconvenience, Jeena. Kindly DM us the booking number and preferred move flight date/ time. Thank you. -Miza",896779,896781
896782,AirAsiaSupport,FALSE,Sat Oct 21 03:08:52 +0000 2017,"@332967 Hi Roberta, Apologies on this as twitter do not handle refunds.The team will inform via email once request is Done.TQ-Emir",,896783
896784,AirAsiaSupport,FALSE,Sat Oct 21 02:59:01 +0000 2017,@258166 You may just take note on the refund processing fee.That will be deducted by the refund amount.Thanks-Emir,896785,896786
896787,AirAsiaSupport,FALSE,Sat Oct 21 07:39:58 +0000 2017,"@258166 Hi Paige, we have replied you via DM , see you there! - Anwar",,896785
896788,AirAsiaSupport,FALSE,Sat Oct 21 02:33:24 +0000 2017,@258166 &gt;&gt; Note that it is also subject to Refund Fee. Refer here https://t.co/VyQJYYofA4  for Fees and Charges. Thank you. -Miza,896786,896789
896791,AirAsiaSupport,FALSE,Sat Oct 21 02:17:53 +0000 2017,"@258166 Cancellation is not allowed as payments made are non-refundable, Paige. Only Airport tax can be refunded. Thank you. -Miza",896789,896792
896793,AirAsiaSupport,FALSE,Sat Oct 21 02:01:19 +0000 2017,"@258166 Hi dear, may we have your booking number to assist further. Thanks-Mich","896,792,896,794",896795
896796,AirAsiaSupport,FALSE,Thu Oct 19 22:42:49 +0000 2017,"@258166 You may split the booking online via Manage My Booking&gt;Modify&gt;Edit Itinerary&gt;Split, Paige. :) -Miza","896,797,896,795,896,000",896799
896800,AirAsiaSupport,FALSE,Thu Oct 19 10:01:43 +0000 2017,"@258166 Hi there! Sure, you may do it online via Manage my Booking up to 48 hours before departure subject to applicable fees. -Floi",896799,896801
896802,AirAsiaSupport,FALSE,Sat Oct 21 02:57:15 +0000 2017,"@332968 Hi, the refund is already under processing. Apologies on the misunderstanding.The team will follow up with you via Email.Tq-Emir",,896803
896804,AirAsiaSupport,FALSE,Sat Oct 21 02:45:04 +0000 2017,"@332969 We have replied to your DM, Mike. :) -Miza",,896805
897852,AirAsiaSupport,FALSE,Sat Oct 21 03:44:33 +0000 2017,"@333231 We've forwarded the request to the team, Rehm. Revised itinerary will be sent out once done. :) -Miza",897853,897854
897855,AirAsiaSupport,FALSE,Sat Oct 21 02:01:50 +0000 2017,"@333231 Hi Rehm, Sila confirm kalau anda mahu ubah ke QZ206 24OCT17 CGK-KUL 18:55-22:00. Terima kasih-Emir",897854,6029
897856,AirAsiaSupport,FALSE,Sat Oct 21 03:41:18 +0000 2017,"@333232 sure helmi, may we have your preferred luggage weight and passenger full name for add ons. Thanks-Mich",,897857
897858,AirAsiaSupport,FALSE,Sat Oct 21 03:24:17 +0000 2017,"@333233  lim , may we have the preferred weight and passenger full name to add ons. Thanks-Mich",,897859
897860,AirAsiaSupport,FALSE,Sat Oct 21 03:22:56 +0000 2017,@333234 &gt;&gt; 48 hours before departure subject to CHANGE FEE + FARE DIFFERENCE. Refer here https://t.co/VyQJYYofA4 for Change Fee. -Miza,,897861
897862,AirAsiaSupport,FALSE,Sat Oct 21 03:22:38 +0000 2017,"@333234 Route Change is not allowed, Aziera. You may only make a flight change of date/ time online via Manage my Booking up to &gt;&gt;",897863,897861
897864,AirAsiaSupport,FALSE,Sat Oct 21 08:01:29 +0000 2017,"@333234 Hi dear, You are most welcome, Do let us know If any Further assistance is Needed. Thank you and have a Great day-Mich",,897863
897865,AirAsiaSupport,FALSE,Sat Oct 21 03:21:32 +0000 2017,"@333235 Hi Aida, kindly DM us the guest's passport copy for verification. Thank you. -Miza",,897866
899058,AirAsiaSupport,FALSE,Sat Oct 21 04:14:15 +0000 2017,"@128670 Dear Septia, we have assisted on name correction, kindly check your email for revised itinerary. Thanks - Emir",,899059
899060,AirAsiaSupport,FALSE,Sat Oct 21 04:02:43 +0000 2017,"@333469 We have replied to your DM, Melati. Check it out! :) -Miza",,899061
899062,AirAsiaSupport,FALSE,Sat Oct 21 04:02:31 +0000 2017,@333470 Hi Vandana. Correction is done.May refer to your email for the updated itinerary.Thanks-Emir,,899063
899064,AirAsiaSupport,FALSE,Sat Oct 21 04:00:43 +0000 2017,"@333471 Hi Nishadh, appreciate if you could liaise with BIG team directly as they are handling the accounts management @142624",,899065
899066,AirAsiaSupport,FALSE,Sat Oct 21 03:58:42 +0000 2017,@333472 we have replied to your DM. Thanks-Mich,899067,899068
899069,AirAsiaSupport,FALSE,Sat Oct 21 11:19:25 +0000 2017,"@333472 Hi, we have replied to your DM already. Appreciate can check your DM. Thanks-Sha",,899067
899070,AirAsiaSupport,FALSE,Sat Oct 21 03:56:09 +0000 2017,"@333473 Hi there, yes! You may carry powerbank with maximum capacities of 32,000mAh on board. :) -Miza",,899071
899072,AirAsiaSupport,FALSE,Sat Oct 21 03:50:47 +0000 2017,"@333235  Dear Aida, name amended as per passport, may refer email for revised itinerary. Thanks-Mich",899073,897867
899615,AirAsiaSupport,FALSE,Wed Nov 01 13:55:00 +0000 2017,"@120081 Name correction done, Hoon. Check out your mailbox for the revised itinerary! :) -Miza",,899616
904904,AirAsiaSupport,FALSE,Sat Oct 21 01:12:22 +0000 2017,"@334840 Sure Elvy, we have amended guest title, kindly check email for the updated itinerary. Thanks-Mich",,904905
904908,AirAsiaSupport,FALSE,Sat Oct 21 01:11:58 +0000 2017,"@334842 Sure, KK. Kindly DM us the guest's IC copy for verification. Thank you. -Miza",,904909
904911,AirAsiaSupport,FALSE,Sat Oct 21 01:08:22 +0000 2017,@334843 Please be advised that Infant will be charged for Infant Fee. Refer here https://t.co/VyQJYYofA4 for Fees and Charges. -Miza,,904912
904914,AirAsiaSupport,FALSE,Sat Oct 21 01:05:44 +0000 2017,"@334844 Hi Kris, we have replied to your DM, kindly check. Thanks-Mich",,904915
906230,AirAsiaSupport,FALSE,Sat Oct 21 01:43:46 +0000 2017,"@335156 Hi Ashleigh , please provide us your booking number and the airasia member ID via DM. Thanks",906231,906232
906233,AirAsiaSupport,FALSE,Mon Oct 23 08:51:12 +0000 2017,"@335156 Sorry but flight retimed less than 45 mins, as there are no option provided for booking AGVZNP. Thanks - Ed",906234,906231
906235,AirAsiaSupport,FALSE,Mon Oct 23 12:12:04 +0000 2017,"@335156 Hi, you may submit your request at https://t.co/lNbaPawXrm and attach doctor's letter for further consideration. Thanks - Ed",906236,906234
906237,AirAsiaSupport,FALSE,Mon Oct 23 19:28:12 +0000 2017,"@335156 Hi Ashley , If you had submitted the form our team will be reverting back to you soon regarding your concern. Thanks",,906236
906238,AirAsiaSupport,FALSE,Thu Oct 19 17:07:52 +0000 2017,@335156 Do you mean Credit Shell ? 90 days to utilized the credit shell. You may make booking for future flight - Ed,906232,906239
906240,AirAsiaSupport,FALSE,Tue Jul 11 09:28:14 +0000 2017,@335156 CAS-19216973-SKCNSS number have been reply on 10/07/2017. Please check your mailbox. Thank you. -Prabu,906239,906241
906242,AirAsiaSupport,FALSE,Sat Oct 21 01:41:49 +0000 2017,"@335157 Oh, that's the Agency email, Shafiq. You'll have to refer to them directly for the itinerary. Thank you. -Miza",906243,906244
906245,AirAsiaSupport,FALSE,Sat Oct 21 08:12:52 +0000 2017,"@335157 Hi There, that will be fine, as long you print the boarding pass. Thank you. -Prabu",,906243
906250,AirAsiaSupport,FALSE,Sat Oct 21 01:28:57 +0000 2017,"@335158 Hi Fran,  you can do it up to 48 hours before departure via Manage My Booking subject to Change Fee + Fare Difference -Thanks-Mich",906251,906252
906253,AirAsiaSupport,FALSE,Sat Oct 21 11:57:22 +0000 2017,"@335158 Hi,The terminal will be Ninoy Aquino International Airport. Kindly refer this link https://t.co/mSt47cuOlV Thanks-Sha",,906251
906254,AirAsiaSupport,FALSE,Sat Oct 21 01:28:07 +0000 2017,"@335158 Dear Fran, Kindly refer to  https://t.co/mSt47cuOlV list of airport terminals. Thanks-Mich",,906255
906256,AirAsiaSupport,FALSE,Sat Oct 21 01:18:21 +0000 2017,"@335159 Sorry but it's not available, Chareze. How may we assist you though? -Miza",,906257
907227,AirAsiaSupport,FALSE,Sat Oct 21 02:13:24 +0000 2017,"@335425 Hi There. for the booking FF6FUV , we have already sent the airport tax refund to your card company on 09/05/2017.Thanks-Emir",,907228
907229,AirAsiaSupport,FALSE,Fri Oct 20 10:06:48 +0000 2017,"@335425 Hi M Mu'afi Himam , We have replied you via DM. Thanks-Emir",907228,907230
907231,AirAsiaSupport,FALSE,Sat Oct 21 02:12:17 +0000 2017,"@335426 The guests' names are correct in the booking.  So,no changes needed. :) -Miza",907232,907233
907234,AirAsiaSupport,FALSE,Sat Oct 21 07:21:43 +0000 2017,"@335426 You're most welcome, do let us know if any further assistance is needed. Thank you and have a great day - prabu",,907232
907236,AirAsiaSupport,FALSE,Fri Oct 20 11:47:32 +0000 2017,@335426 - Correction done. Please check your mailbox for the revised itinerary. Thank you-Anwar,907235,907237
907238,AirAsiaSupport,FALSE,Thu Oct 19 08:02:53 +0000 2017,"@335426 Dear Singup, please reattach your passport copy and booking number here. We will see what we can do for you ya =) Yana",907237,907239
907240,AirAsiaSupport,FALSE,Sat Oct 21 02:07:27 +0000 2017,"@335427 Yes, we can see the baggage allowance added, Zyra. Payment can be made at the counter upon check-in. :) -Miza",907241,907242
907243,AirAsiaSupport,FALSE,Sat Oct 21 13:06:46 +0000 2017,"@335427 Hi Zyra , 20 kg has been added in your booking BEEVHL. Cheers - Khairul","907,244,907,245",907241
907246,AirAsiaSupport,FALSE,Sat Oct 21 15:23:03 +0000 2017,"@335428  Kindly please clear your browser's history, cookies and cache or change browser and try again. Try via Mobile App too. Thx -PR",907247,907244
907248,AirAsiaSupport,FALSE,Sun Oct 22 14:06:46 +0000 2017,"@335427 Hi Zyra, you will need to pay 736.00 THB at check in counter for 20KGm,see you on board soon!- Anwar",,907245
907249,AirAsiaSupport,FALSE,Fri Oct 20 05:20:51 +0000 2017,"@335427 Hey Zyra, sure. May we have the booking number to check for you? Updated itinerary will be sent too once payment  done. -Floi",907242,907250
907251,AirAsiaSupport,FALSE,Sat Oct 21 02:05:56 +0000 2017,"@335429 Sorry for the confusion, Song. The request is still on process. You'll be notified accordingly via Email on the status. Thanks -Miza",,907252
907253,AirAsiaSupport,FALSE,Sat Oct 21 02:01:56 +0000 2017,"@335429 Hi Song, sorry but you have to submit your request via https://t.co/yUyvTZDtHT as bank account details are required. Thanks. -Miza",,907252
896790,AirAsiaSupport,FALSE,Sat Oct 21 02:33:09 +0000 2017,"@258166 Add ons are non-refundable too, Paige. You may refer to the last page of the itinerarry for the Airport Tax fee. &gt;&gt;",,896789
907254,AirAsiaSupport,FALSE,Sat Oct 21 01:51:56 +0000 2017,"@335430 Hi Nieys, We have replied to you via DM, Thanks-Emir","907,255,907,256",907257
907258,AirAsiaSupport,FALSE,Sat Oct 21 01:49:45 +0000 2017,@335432 Hi Salaun . for the refund of booking EWS5FK. It was sent to the bank on 18/08/2017. Thanks-Emir,,907259
907260,AirAsiaSupport,FALSE,Thu Aug 31 01:52:08 +0000 2017,@335432 Sorry but the currency conversion is subject to change from time to time depending on issuing bank. Thanks - Ed,907259,907261
908180,AirAsiaSupport,FALSE,Sat Oct 21 02:39:10 +0000 2017,@335671 That would be a great idea. Will inform the management on this suggestion.Thanks! =) -Emir,,6281
908181,AirAsiaSupport,FALSE,Sat Oct 21 02:31:24 +0000 2017,@335672 Hi Eddie. Please provide us the dob of the passenger for verification purposes.Thanks-Emir,908182,908183
908184,AirAsiaSupport,FALSE,Sat Oct 21 06:05:51 +0000 2017,@335672 You are most welcome -Thanks-Emir,,908182
909267,AirAsiaSupport,FALSE,Sat Oct 21 05:20:31 +0000 2017,"@335974 Hi Enry, Kindly refer to your DM. Thanks-Mich",,909268
910104,AirAsiaSupport,FALSE,Sat Oct 21 06:03:52 +0000 2017,"@336181 Alright Rick, Kindly submit bank transaction history along with booking number thru https://t.co/yUyvTZDtHT. Thanks-Mich",910105,910106
910107,AirAsiaSupport,FALSE,Fri Oct 20 02:22:23 +0000 2017,"@336181 Sure Rick, but we can confirm that there's no double payment in the booking. You'll have to refer to your bank. -Floi",910106,910108
910109,AirAsiaSupport,FALSE,Thu Oct 19 04:12:31 +0000 2017,"@336181 Sorry for the inconvenience, Rick. May we have the booking number to check? -Miza","910,110,910,108",910111
910112,AirAsiaSupport,FALSE,Sat Oct 21 06:02:03 +0000 2017,"@336182 Hi,Due to overwhelming responses from our guests,we will at times experience high volumes of tweet. Apologies for late response. Sha",910113,910114
910115,AirAsiaSupport,FALSE,Sat Oct 21 04:58:38 +0000 2017,"@336182 Sure, Peet! Kindly DM us the booking number, guest's name and correct title. :) -Miza",910114,910116
910117,AirAsiaSupport,FALSE,Sat Oct 21 05:54:25 +0000 2017,"@336183 Refund for booking KN4BNR has been successfully processed on 18Aug17, Alan. Kindly DM us so we can provide you with details -Miza",,910118
910126,AirAsiaSupport,FALSE,Sat Oct 21 05:50:44 +0000 2017,"@336184 Hi Nur,yes 4hours before departure is allow, may we have your preferred weight, passenger full name and booking number.Thanks-Mich",,910127
910899,AirAsiaSupport,FALSE,Sat Oct 21 06:27:14 +0000 2017,"@336344 Hi Gem, may we have your booking number to assist further. Thanks-Mich",910900,910901
910902,AirAsiaSupport,FALSE,Sat Oct 21 12:44:41 +0000 2017,"@336344 Hi There, sorry for the inconvenience. You may opt free flight change or Full Credit Shell. Which do you prefer?  -Prabu",910903,910900
910906,AirAsiaSupport,FALSE,Sat Oct 21 06:25:33 +0000 2017,"@336345 Dear Mikey, kindly refer to your DM =) Thanks-Mich",,910907
910908,AirAsiaSupport,FALSE,Sat Oct 21 06:25:19 +0000 2017,"@336346 Apologies on the delay. Due to this we may offer you a move flight within 30 days,Credit Shell or Refund for you to choose.TQ-Emir",,910909
910914,AirAsiaSupport,FALSE,Sat Oct 21 06:25:03 +0000 2017,"@336347 Hi David, Kindly direct message us for passenger passport copy for further assistance. Thanks-Sha",,910915
910916,AirAsiaSupport,FALSE,Sat Oct 21 06:24:22 +0000 2017,@336348 Sorry for the delay response as we received massive requests. The flight was retimed to 10:00. Thank you. -Miza,,910917
910918,AirAsiaSupport,FALSE,Sat Oct 21 06:19:43 +0000 2017,@336349 &gt;&gt; Kindly submit your bank account details via https://t.co/yUyvTZDtHT so it can be processed accordingly. Thank you. -Miza,,910919
910920,AirAsiaSupport,FALSE,Sat Oct 21 06:19:36 +0000 2017,"@336349 Hi Sergei, the amount of 3,087INR in the booking is to be refunded (UDF refund due to India regulatory). &gt;&gt;",,910919
910925,AirAsiaSupport,FALSE,Sat Oct 21 06:17:25 +0000 2017,"@336351 Hi Noor, As per check our colleagues already assisted via Live chat. Apologies for late response. May check your mailbox.-Sha",910926,910927
910928,AirAsiaSupport,FALSE,Sat Oct 21 06:17:05 +0000 2017,"@336352 Hi Danielle, regret on the delayed respond, referring to your booking passenger had departed. Sorry-Mich",,910929
911735,AirAsiaSupport,FALSE,Sat Oct 21 07:13:22 +0000 2017,"@336544 Hi Aliya, Kindly provide us both booking number for further assistance. Thanks-Sha",,911736
911737,AirAsiaSupport,FALSE,Sat Oct 21 07:11:44 +0000 2017,@336545 Hi Sharizawati. you can just dm us the snapshot and we will assist accordingly.Thanks-Emir,,911738
911739,AirAsiaSupport,FALSE,Sat Oct 21 06:49:24 +0000 2017,"@336545 Hi Sha, for DOB amendment, kindly DM us a copy of passenger passport. Thanks-Mich",911738,911740
911741,AirAsiaSupport,FALSE,Sat Oct 21 07:02:41 +0000 2017,"@119774 Hi There, we have replied you via DM,see you there!-Anwar",911742,911743
911744,AirAsiaSupport,FALSE,Sat Oct 21 10:40:56 +0000 2017,"@119774 Hi There, we have respond you via DM, see you there ! - Anwar",911745,911742
911746,AirAsiaSupport,FALSE,Sat Oct 21 11:07:40 +0000 2017,"@119774 Hi Budianto, Kindly check your inbox. We have explain you on Korean Refund policy. Thanks-Sha",911747,911745
911748,AirAsiaSupport,FALSE,Sat Oct 21 20:42:53 +0000 2017,@119774 You are most welcome Budi. Cheers - Khairul,,911747
911749,AirAsiaSupport,FALSE,Sat Oct 21 07:00:09 +0000 2017,"@336546 Hi Goh,yes check-in must be performed via the AirAsia app. E-Boarding Pass is available for one guest in one booking number.-Sha",,911750
911751,AirAsiaSupport,FALSE,Sat Oct 21 06:57:57 +0000 2017,"@336547 Kami telah memberi tindak balas melalui DM, Agustina! :) -Miza",,6032
911752,AirAsiaSupport,FALSE,Sat Oct 21 06:56:53 +0000 2017,"@336548 Hi Fatin, Any sort of chemical is not allowed in the checked baggage.Thanks-Emir",,911753
911754,AirAsiaSupport,FALSE,Sat Oct 21 06:53:31 +0000 2017,"@336549 Hi There, sorry,but as we can see moved flight done as pre request already. Thank you. -PR","911,755,911,756,911,000,000,000,000,000",911760
911761,AirAsiaSupport,FALSE,Sat Oct 21 10:07:10 +0000 2017,@336549 The revised itinerary will be sent out once done. Thanks-Sha,,911756
911762,AirAsiaSupport,FALSE,Sat Oct 21 10:06:27 +0000 2017,@336549 We have assisted to forward your case again to move back original details as :: GSZDHB as PEN-SGN 26 OCT 2017 1210. &gt;&gt;,911764,911756
911765,AirAsiaSupport,FALSE,Sat Oct 21 10:41:28 +0000 2017,"@336549 Hi Lee, We will try to solve this as soon as possible or appreciate you can provide us 3 workings days to solve this out. -Sha",911766,911764
911767,AirAsiaSupport,FALSE,Sat Oct 21 10:49:26 +0000 2017,@336550 We have assisted to forward your case. Appreciate can allow us some time to solve this. Thanks-Sha,,911766
911768,AirAsiaSupport,FALSE,Sat Oct 21 10:49:07 +0000 2017,@336550 We understand your frustration and apologies for the inconvenience.,,911766
911763,AirAsiaSupport,FALSE,Sat Oct 21 10:06:12 +0000 2017,"@336549 Hi, we sincerely apologize for having caused any confusion. &gt;&gt;",,911756
911769,AirAsiaSupport,FALSE,Sat Oct 21 10:40:20 +0000 2017,"@336549 Hi Lee, We will try to solve this as soon as possible or appreciate you can provide us 3 workings days to solve this out. -Sha","911,770,911,771",911757
911772,AirAsiaSupport,FALSE,Sat Oct 21 14:02:29 +0000 2017,@336549 We are noted on this concern and it has been escalated for approval. Revised itinerary will be sent to you soon. Thanks,,911770
911773,AirAsiaSupport,FALSE,Sat Oct 21 09:47:34 +0000 2017,"@336549 Hi Chia Shiun,  we have replied you via DM , Thanks- Anwar",,911758
911774,AirAsiaSupport,FALSE,Sat Oct 21 10:09:22 +0000 2017,@336549 The revised itinerary will be sent out once done. Thanks-Sha,911777,911759
911775,AirAsiaSupport,FALSE,Sat Oct 21 10:09:15 +0000 2017,@336549 We have assisted to forward your case again to move back original details as :: GSZDHB as PEN-SGN 26 OCT 2017 1210. &gt;&gt;,,911759
911776,AirAsiaSupport,FALSE,Sat Oct 21 10:09:02 +0000 2017,"@336549 Hi, we sincerely apologize for having caused any confusion. &gt;&gt;",,911759
911779,AirAsiaSupport,FALSE,Sat Oct 21 06:51:33 +0000 2017,"@336551 Dear Rikkie, kindly refer to big channel at https://t.co/edZxADKjVU. Thanks-Mich",,911780
911787,AirAsiaSupport,FALSE,Sat Oct 21 06:49:53 +0000 2017,"@258166 Hi There, sorry, flight can't be split only guest can be done via Manage my Booking&gt;Modify&gt;Edit Itinerary&gt;Split booking. -PR",,896797
912649,AirAsiaSupport,FALSE,Sat Oct 21 07:41:28 +0000 2017,"@336732 Hi Suwan, sorry but once a booking is confirmed cancellation,transfer,changes,refund and reverse is not allowed. -Prabu",,912650
912651,AirAsiaSupport,FALSE,Sat Oct 21 07:40:27 +0000 2017,"@336733 Hi skoyles , As of now all flights are on as usual , If theres changes You will be notified.Thanks-Emir",,912652
912653,AirAsiaSupport,FALSE,Sat Oct 21 07:39:50 +0000 2017,"@336734 Hi There, we can't advice on that, you may E-mail us at  https://t.co/UbGaaZSLuG  for further assistance on your refund request.",,912654
912655,AirAsiaSupport,FALSE,Sat Oct 21 07:38:54 +0000 2017,"@336735 Hi Reeman, kindly refer to https://t.co/R4fFIFlsDT, contact list is up to date. Kindly try again.Thanks-Mich",,912656
912657,AirAsiaSupport,FALSE,Sat Oct 21 07:36:24 +0000 2017,"@336736 Hi There, may we have the guest date of birth for verification?  -Prabu",912658,912659
912660,AirAsiaSupport,FALSE,Sat Oct 21 07:56:30 +0000 2017,"@336736 Hi There, name correction done. Please check your mailbox for the revised itinerary. Thank you. -Prabu",912661,912658
912662,AirAsiaSupport,FALSE,Sat Oct 21 11:33:50 +0000 2017,"@336736 Hi, Youâ€™re welcome. Have a good day. Thanks-Sha",,912661
912663,AirAsiaSupport,FALSE,Sat Oct 21 07:32:03 +0000 2017,"@336737 Hi dear, we have DM your =) Thanks-Mich",,912664
912665,AirAsiaSupport,FALSE,Sat Oct 21 07:26:13 +0000 2017,"@336738 Hi There, may we have the screenshot of the ID copy with the guest date of birth for verification.-Prabu",912666,912667
912668,AirAsiaSupport,FALSE,Sat Oct 21 07:18:32 +0000 2017,"@336739 Hi Afzan,yes you will need to proceed to the document check counters,after which a valid boarding pass will be issued.Thanks-Sha",912669,912670
912671,AirAsiaSupport,FALSE,Sat Oct 21 09:54:19 +0000 2017,"@336739 You're most welcome, do let us know if any further assistance is needed. Thank you and have a great day - prabu",,912669
912681,AirAsiaSupport,FALSE,Sat Oct 21 07:16:28 +0000 2017,"@336740 Hi There, may we have the booking number, guest's name and correct title? -Prabu",912682,912683
912684,AirAsiaSupport,FALSE,Sat Oct 21 09:24:48 +0000 2017,"@336740 Hi, your booking has been check in already. We advise you proceed to counter for title correction with no fee. Thanks-Sha",912685,912682
912686,AirAsiaSupport,FALSE,Sat Oct 21 14:12:56 +0000 2017,"@336740 yes correct, see you on board soon! - Anwar",,912685
913529,AirAsiaSupport,FALSE,Sat Oct 21 08:14:20 +0000 2017,"@336947 Hi There, may we have the booking number and email ID for a check? -Prabu",,913530
913531,AirAsiaSupport,FALSE,Sat Oct 21 08:09:31 +0000 2017,"@336948 Hi, Can we the booking number for further assistance. Thanks-Sha",,913532
913533,AirAsiaSupport,FALSE,Sat Oct 21 08:00:44 +0000 2017,"@336950 Hi There, sorry, but FD flights tax invoice is not available. Thank you. -Prabu",,913534
913535,AirAsiaSupport,FALSE,Sat Oct 21 07:56:56 +0000 2017,"@336951 Hi Azmil , Please provide us the passenger name and flight details and also the screen shot of payment made for us to assist.TQ",,913536
913537,AirAsiaSupport,FALSE,Sat Oct 21 07:53:31 +0000 2017,@336952 Since your flight boarded we advise to submit an email for your feedback or concern via https://t.co/yUyvTZDtHT Thanks-Sha,,913538
913538,AirAsiaSupport,FALSE,Sat Oct 21 07:51:34 +0000 2017,"@336952 Hi, Baggage supersize (you may purchase/upgrade baggage up to 4 hours to departure time.)",913537,913539
913540,AirAsiaSupport,FALSE,Sat Oct 21 07:50:18 +0000 2017,"@336953 Hi There, we have linked the booking to this email ID __email__.  Check it out !!!",,913541
913542,AirAsiaSupport,FALSE,Sat Oct 21 07:48:31 +0000 2017,"@226979 sure Fauzi, we have amended the title, kindly check email for the updated itinerary. Thanks-Mich",,913543
