tweet_id,author_id,inbound,created_at,text,response_tweet_id,in_response_to_tweet_id
573352,AirAsiaSupport,FALSE,Wed Nov 29 06:44:56 +0000 2017,"@254768 Sure Jon, we've replied your DM. Credit is already applied, you may start using it. Thanks. -Floi",573351,573353
573354,AirAsiaSupport,FALSE,Wed Nov 29 03:03:46 +0000 2017,"@254768 Sorry for the delay, Jon. We've replied to your DM. Thanks. -Floi","573,355,573,353",573356
573359,AirAsiaSupport,FALSE,Sun Dec 03 05:19:10 +0000 2017,"@254769 Hi Erik, we do apologize for the delay in response as we are receiving massive amount of queries and request at the moment. Kindly DM us the passenger passport / ID and we will get this sorted for you. Thanks - Nod",573360,573361
573362,AirAsiaSupport,FALSE,Wed Nov 29 05:54:19 +0000 2017,"@254769 Apologies for taking so long in responding to your tweet. We've assisted you via DM, kindly check your inbox. Thanks-Sha",573361,573363
573364,AirAsiaSupport,FALSE,Sun Dec 03 05:18:49 +0000 2017,@254770 Apologies for taking so long in responding to your tweet. Kindly elaborate further via DM with booking number about your concern in order for us to assist you. Thanks-Sha,,573365
574065,AirAsiaSupport,FALSE,Sun Dec 03 06:42:30 +0000 2017,"@254994 Hi Jon :) As per check on IFWNGL, we operate as per normal, can you explain further on your concern for us to understand you better? - See you! - Anwar",,574066
574068,AirAsiaSupport,FALSE,Sun Dec 03 06:30:45 +0000 2017,"@ì‹¬ì¤€í˜¸ Hi, could you advise us the booking number and the case number received after submitting the form ? - Nod","574,066,574,069,574,000,000,000,000,000,000,000,000,000",
574075,AirAsiaSupport,FALSE,Sun Dec 03 06:41:24 +0000 2017,"@254995 Hi, kindly tweet us in English or you may contact our Thailand Call Centre +66 2 515 9999 for further assistance. Thanks â€“ Nod",,574076
574078,AirAsiaSupport,FALSE,Sun Dec 03 06:40:51 +0000 2017,"@254996 Hi Deejay, We would like to know more on your
concern. Kindly share with us via DM and weâ€™ll provide a swift action on it. Thanks. -Mi",,574079
574080,AirAsiaSupport,FALSE,Sun Dec 03 06:39:51 +0000 2017,@254997 Hi There :) Can we have the booking number for us to check further? :) See you!- Anwar,,574081
574082,AirAsiaSupport,FALSE,Sun Dec 03 06:39:24 +0000 2017,"@254998 Hi Hanny, we have respond to your DM. Thanks. -Mi",,574083
574084,AirAsiaSupport,FALSE,Sun Dec 03 06:36:53 +0000 2017,"@226394 Sorry for that Vineet :) As per check we already provide credit shell to your  big id and kindly refer here on how to check your credit shell and use it https://t.co/PnSagJE8tM
https://t.co/xT1HaU2s1f -Anwar","574,085,574,086",574087
574088,AirAsiaSupport,FALSE,Sun Dec 03 06:21:46 +0000 2017,"@226394  Apologies for taking so long in responding to your tweet. Upon checking, TJ5URS :: this booking has been assisted for credit shell. You may check your member account. Thanks-Sha",574087,574089
574092,AirAsiaSupport,FALSE,Sun Dec 03 06:36:08 +0000 2017,"@254999 Hi Siwaporn,appreciate if you could write in English so that we could assist you further.Thank you =) Yana",,574093
574094,AirAsiaSupport,FALSE,Sun Dec 03 06:34:29 +0000 2017,@255000  May we have your booking number for a check please? -Yana,,574095
574096,AirAsiaSupport,FALSE,Sun Dec 03 06:33:02 +0000 2017,"@255001 Hi Tarek , we do apologize for the delay in response as we are receiving massive amount of queries and request at the moment. Kindly refer here : https://t.co/EGEDIiPA0p for any latest update in regards of the situation in Bali. Thanks - Nod",,574097
574098,AirAsiaSupport,FALSE,Sun Dec 03 06:32:43 +0000 2017,"@255002 &gt;&gt; Seats are being sold constantly, making the availability and prices change all the time.- Thanks - Anwar",,574099
574100,AirAsiaSupport,FALSE,Sun Dec 03 06:32:25 +0000 2017,"@255002 &gt;&gt; Nevertheless, please keep trying combination of different dates and you might be lucky to secure big deals. AirAsia system works on real-time, availability and prices can change in between when you check the availability and when you reserve the seat. &gt;&gt;",,574099
574101,AirAsiaSupport,FALSE,Sun Dec 03 06:32:05 +0000 2017,@255002 Hi There :) We have fee for the infant and you can see infant fee in here https://t.co/jNMqRBUZdx and our promo fares are for a limited number of flights and are grabbed quickly within minutes after a promotion is launched. &gt;&gt;&gt;,,574099
574102,AirAsiaSupport,FALSE,Sun Dec 03 06:31:06 +0000 2017,"@255003 Sincere apologies for the delay in response due to overwhelming feedback from our guest at the moment. Sure Ark, kindly DM us your booking number, name and correct title for verification. Thanks. -Mi",,574103
574104,AirAsiaSupport,FALSE,Sun Dec 03 06:29:57 +0000 2017,@255004 Hi There :) Can we have the booking number? and attach the passport copy in here :) Let see what we can do :) See you! - Anwar,,574105
574106,AirAsiaSupport,FALSE,Sun Dec 03 06:29:04 +0000 2017,"@255005 Hi Jill, we are sorry for the delay in response, it is caused by massive tweets due to Mount Agung eruptions. Have your relatives arrive safely? -Yana",,574107
574108,AirAsiaSupport,FALSE,Sun Dec 03 06:28:33 +0000 2017,"@255006 Kindly share your booking number via DM, so we may look into it to you advise accordingly. Thanks-Sha",574109,574110
574111,AirAsiaSupport,FALSE,Sun Dec 03 07:12:11 +0000 2017,@255006 Appreciate if could share your booking number and will advise accordingly. Thanks-Sha,,574109
574113,AirAsiaSupport,FALSE,Sun Dec 03 06:27:15 +0000 2017,"@255007 Dear Anshul, please provide one of the passengers member email ID via DM to proceed with credit shell since it can only be applied to passengers account. -Yana",,574114
574115,AirAsiaSupport,FALSE,Sun Dec 03 06:23:48 +0000 2017,@255008 Hi There :) Can we have the booking number for us to check further? :) See you!- Anwar,,6404
574116,AirAsiaSupport,FALSE,Sun Dec 03 06:18:49 +0000 2017,"@255009 Hi Vijay, we do apologize for the delay in response as we are receiving massive amount of queries and request at the moment. Could you elaborate further on how we may assist you ? - Nod",,574117
574119,AirAsiaSupport,FALSE,Sun Dec 03 06:15:00 +0000 2017,"@255010 Hi Jordan , we do apologize for the delay in response as we are receiving massive amount of queries and request at the moment. Kindly refer here : https://t.co/EGEDIiPA0p for the latest update in regards of the situation in Bali. - Nod",,64938
574120,AirAsiaSupport,FALSE,Sun Dec 03 06:10:28 +0000 2017,"@255011 Hi There, kindly contact our Korea call center for assistance in Korean language https://t.co/Fy7Fp72QH0 Thanks- Anwar",,574121
574122,AirAsiaSupport,FALSE,Sun Dec 03 06:08:57 +0000 2017,"@255012 Hi, mohon maaf atas kelewatan kami. Bagi tempahan agent / 3rd party anda tidak boleh prebook meal melalui online. Anda boleh DM kami untuk bantuan lanjut dan kami akan bantu anda untuk prebook meal tersebut. Mohon maaf sekali lagi atas segala kesulitan - Nod",,574123
574124,AirAsiaSupport,FALSE,Sun Dec 03 06:00:31 +0000 2017,@255013 May we have your booking number via Dm for a check please Geumbyel? =) Yana,,574125
574188,AirAsiaSupport,FALSE,Wed Feb 12 04:00:47 +0000 2014,"@255040 Hi, Kindly submit your request via E-Form at http://t.co/K6AyoYyEnJ for further assistance. Thank you.",574189,574190
574192,AirAsiaSupport,FALSE,Wed Dec 18 03:13:40 +0000 2013,"@255040 Hi, may I have the booking number and the correct details?",574191,574193
574757,AirAsiaSupport,FALSE,Sun Dec 03 07:27:20 +0000 2017,@255208 Sincere apologies for the delay in response due to overwhelming feedback from our guest at the moment. Kindly DM us your booking number and we'll assist further. Thanks. -Mi,,574758
574759,AirAsiaSupport,FALSE,Sun Dec 03 07:25:24 +0000 2017,"@255209  Sincere apologies for the delay in response due to overwhelming feedback from our guest at the moment.We have tried is working,please insert family name:LAI and given name:KIN FATT, clear your browser's history,cookies and cache or change browser and try again.Thanks-Mi",,574760
574761,AirAsiaSupport,FALSE,Sun Dec 03 07:23:09 +0000 2017,"@255210 Dear Angus, we had sent you the details via DM, kindly check your inbox. Thanks-Sha",,574762
574763,AirAsiaSupport,FALSE,Sun Dec 03 07:20:06 +0000 2017,"@255211 Sincere apologies for the delay in response due to overwhelming feedback from our guest at the moment. Kindly Dm us your booking number, we'll assist further. Thanks. -Mi",,64941
574067,AirAsiaSupport,FALSE,Sun Dec 03 07:12:34 +0000 2017,"@254994  Hi Jon, you may retrieve boarding pass via https://t.co/pjTF2ZY1Fz or at the counter, no charges. Thanks.-Mi",574764,574066
574765,AirAsiaSupport,FALSE,Sun Dec 03 07:09:10 +0000 2017,@255212 Kindly provide us guest big id if you agree :) See you! â€“ Anwar,,574766
574769,AirAsiaSupport,FALSE,Sun Dec 03 06:54:40 +0000 2017,@255212 Hi There :) Can we have the booking number for us to check further? :) See you!- Anwar,574766,574770
574767,AirAsiaSupport,FALSE,Sun Dec 03 07:08:55 +0000 2017,@255212 It's valid for 90 days. You can use it to make new bookings even for different guests and different destinations or pay for Add ons too. Departure date can be anytime as long as it's utilized within the 90 days period.*** &gt;&gt;,574771,574766
574768,AirAsiaSupport,FALSE,Sun Dec 03 07:08:39 +0000 2017,"@255212 As per check on your booking VF8RYE,its under refund process and refund is within 30 working days. We hope you can consider of getting a credit shell for faster process :) *** Credit Shell is the process of refunding the amount back to the guest's AirAsia member ID. &gt;&gt;",,574766
574772,AirAsiaSupport,FALSE,Sun Dec 03 07:03:48 +0000 2017,@255213 May we have your booking number for a check please Bryony? -Yana,574773,574774
574775,AirAsiaSupport,FALSE,Sun Dec 03 06:59:36 +0000 2017,"@223108 Hi Rob, we have respond to your DM. Thanks. -Mi","574,776,574,777",574778
574779,AirAsiaSupport,FALSE,Sun Dec 03 06:56:18 +0000 2017,@255214 Hi There :) Can we have the booking number for us to check further? :) See you!- Anwar,,574780
574781,AirAsiaSupport,FALSE,Sun Dec 03 06:55:17 +0000 2017,"@197460 Hi There, name correction done. Please check your mailbox for the revised itinerary. Thank you. -Prabu",,574782
574783,AirAsiaSupport,FALSE,Sun Dec 03 06:54:19 +0000 2017,"@255215  Hi, We regret for any inconvenience caused. We would like to know more on your concern. Kindly share with us via DM, booking number and weâ€™ll provide a swift action on it.Thanks. -Mi",,574784
574786,AirAsiaSupport,FALSE,Sun Dec 03 06:53:39 +0000 2017,"@255217 Hi There :) As per check on JFHVKL,you already boarded and we hope all is good with you :) See you! - Anwar",,64943
574787,AirAsiaSupport,FALSE,Sun Dec 03 06:53:13 +0000 2017,"@255218 Kindly share your booking number via DM, so we may look into it to you advise accordingly. Thanks-Sha",,64942
574788,AirAsiaSupport,FALSE,Sun Dec 03 06:52:28 +0000 2017,@255219 Hi There :) Can we have the booking number for us to check further? :) See you!- Anwar,,574789
574790,AirAsiaSupport,FALSE,Sun Dec 03 06:50:58 +0000 2017,@255220 Kami telah membuat semakan dan dapati anda telah menaiki pesawat dengan selamat. =) Yana,,574791
574793,AirAsiaSupport,FALSE,Sun Dec 03 06:49:46 +0000 2017,"@255221 Hi Amalia , could you advise us your booking number for further assistance. Thanks - Nod",574794,574795
574796,AirAsiaSupport,FALSE,Sun Dec 03 06:48:37 +0000 2017,"@255222 Hi Pijat, we do apologize for the delay in response as we are receiving massive amount of queries and request at the moment. Kindly refer here : https://t.co/EGEDIiPA0p for any latest update in regards of the situation in Bali. Thanks - Nod",,574797
575444,AirAsiaSupport,FALSE,Sun Dec 03 08:11:13 +0000 2017,"@255402 We regret for any inconvenience caused, Preeti. We would like to know more on yourconcern. Kindly share with us via DM, booking number and weâ€™ll provide a swift action on it. Thanks. -Mi",,575445
575446,AirAsiaSupport,FALSE,Sun Dec 03 08:09:51 +0000 2017,@255403 Hi There :) Oh no! Kindly uninstall the app and try again :) We encourage you to modify booking via website as its more stable via website :) See you! - Anwar,,575447
575448,AirAsiaSupport,FALSE,Sun Dec 03 08:05:20 +0000 2017,"@255404 Hi Gordon, we have replied to your DM. Thanks. -Mich",,575449
575450,AirAsiaSupport,FALSE,Sun Dec 03 08:03:07 +0000 2017,"@255405 Hi Ling, may we have the full name and email used for booking for a check please? -Yana",,360
575452,AirAsiaSupport,FALSE,Sun Dec 03 07:58:16 +0000 2017,"@255406 Hi There :) Can we have both booking number for us to check further? As we only this booking SFKSPB, can we have the new booking she booked? - See you!- Anwar",575453,575454
575455,AirAsiaSupport,FALSE,Sun Dec 03 11:39:30 +0000 2017,@255406 00535382:: The relevant team is in the midst of processing on your case. Your case has been assigned to the relevant officer to follow on this case. We've forwarded the case again to process accordingly. Thank you very much for your patience. -Sha,,575453
575456,AirAsiaSupport,FALSE,Thu Nov 23 02:21:07 +0000 2017,"@255406 Hi .Apologies on the delay ,However the team is still looking into this case &amp; will get back via email once done.Thanks-Emir",575454,575457
575458,AirAsiaSupport,FALSE,Mon Nov 20 01:18:55 +0000 2017,"@255406 Hi, as we checked it is still in progress and you will be updated via email accordingly. Thanks - Ed",575457,575459
575460,AirAsiaSupport,FALSE,Sat Nov 18 11:53:58 +0000 2017,@255406 Aappreciate your patience on this Salamah-Yana,575459,575461
575462,AirAsiaSupport,FALSE,Sun Dec 03 07:56:17 +0000 2017,"@255407  &gt;&gt; to seat availability; OR
Option 3: Credit Account: Retain the value of fare in a credit account for future travel with AirAsia. The online
Credit Account to be redeemed within 90 calendar days from the date of issue. Thanks. -Mi",575463,575464
575465,AirAsiaSupport,FALSE,Sun Dec 03 07:55:43 +0000 2017,"@255407 &gt;&gt; the same route up to 31st January 2018 without additional
cost and subject to seat availability; OR
Option 2: Rerouting: Reroute to other destination (within AirAsia network) with fare difference applicable, subject &gt;&gt;",,575464
575466,AirAsiaSupport,FALSE,Sun Dec 03 07:55:26 +0000 2017,"@255407 Hi Marloes, At the moment there are no official cancellation from the respective authority and the flight are still operating as per schedule.
However guest do not wish to board may select option,
Option 1: Move flight:Change to a new travel date on &gt;&gt;",,575464
575467,AirAsiaSupport,FALSE,Sun Dec 03 07:49:01 +0000 2017,"@255408 Sincere apologies for the delay in response due to overwhelming feedback from our guest at the moment. 00674217 case successfully submitted to the relevant team, you will be notify on the outcomes shortly. Thanks. -Mi",,575468
575469,AirAsiaSupport,FALSE,Wed Nov 29 08:56:51 +0000 2017,"@255408 Upon checking, your flight QZ 7532 has been cancelled on 01st Dec. Therefore, your booking entitled for refund. &gt;&gt;&gt;","575,470,575,468",575471
575474,AirAsiaSupport,FALSE,Wed Nov 29 05:20:37 +0000 2017,@255408 Which do you prefer? -Prabu,"575,475,575,471",575476
575477,AirAsiaSupport,FALSE,Mon Nov 27 06:40:40 +0000 2017,"@255408 Hi ì§€ì˜, Kindly Direct message your booking number please ? For checking. Thanks- Mariya","575,476,575,478",575479
575481,AirAsiaSupport,FALSE,Sun Dec 03 07:36:30 +0000 2017,@255409 Hi There :) Can we have the booking number for us to check further? :) See you!- Anwar,,571535
575482,AirAsiaSupport,FALSE,Sun Dec 03 07:30:47 +0000 2017,"@255410 Dear Mel, we had sent you the details via DM, kindly check your inbox. Thanks-Sha",,64945
576282,AirAsiaSupport,FALSE,Sun Dec 03 08:56:56 +0000 2017,@255615 Sincere apologies for the delay in response due to overwhelming feedback from our guest at the moment. OQMDFH Glad to know you have been assisted. Do let us know If any Further assistance is Needed. Thank you and have a Great day. -Mi,,576283
576284,AirAsiaSupport,FALSE,Sun Dec 03 08:53:51 +0000 2017,@255616 Hi Cherrie :) How can we assist you in here? - See you! - Anwar,,576285
576290,AirAsiaSupport,FALSE,Sun Dec 03 08:52:33 +0000 2017,@255618  Sincere apologies for the delay in response due to overwhelming feedback from our guest at the moment. Glad to know you have been assisted on credit shell. Do let us know If any Further assistance is Needed. Thank you and have a Great day. -Mi,,576291
576292,AirAsiaSupport,FALSE,Sun Dec 03 08:41:04 +0000 2017,"@255619 Sincere apologies for the delay in response Woo, due to overwhelming feedback from our guest at the moment. Sure, we have updated your request, may refer manage my booking account. Thanks. -Mich",,576293
576294,AirAsiaSupport,FALSE,Sun Dec 03 08:40:56 +0000 2017,@255408 NWQCJA ::00674217::The relevant team is in the midst of processing on your case. Your case has been assigned to the relevant officer to follow on this case. Please note that this process may take up to 30 working days. Thanks-Sha,576295,576296
576297,AirAsiaSupport,FALSE,Sun Dec 03 19:34:12 +0000 2017,"@255408 Yes it is to your account ,As for any documents request please have it requested via Eforms.Thanks-Emir",576298,576295
576301,AirAsiaSupport,FALSE,Wed Nov 29 09:16:16 +0000 2017,@255408 Sure Jiyoung. You'll be updated accordingly via email once the refund request is attended and processed. Thanks. -Floi,"576,302,576,299",576303
575473,AirAsiaSupport,FALSE,Wed Nov 29 08:57:00 +0000 2017,@255408 Kindly file a form (https://t.co/yUyvTZDtHT) for refund request. At feedback column please state clearly your request.&gt;&gt;&gt;,576303,575471
576304,AirAsiaSupport,FALSE,Sun Dec 03 08:39:03 +0000 2017,"@255620 Dear Marly, please provide your booking number and passengers name for title correction. We will have it checked for you =) Yana",,576305
576306,AirAsiaSupport,FALSE,Sun Dec 03 08:24:34 +0000 2017,@255621 We are terribly sorry for the delay in response due to massive volume of tweets coming in. We can see you have boarded safely . Have a safe trip and take care-Yana,,6406
576307,AirAsiaSupport,FALSE,Sun Dec 03 08:14:47 +0000 2017,@255622 Sincere apologies for the delay on this case. The relevant team is in the midst of processing on your case. Your case has been assigned to the relevant officer to follow on this case. Please note that this process may take up to 30 working days. Thanks-Sha,,576308
576309,AirAsiaSupport,FALSE,Sun Dec 03 08:14:42 +0000 2017,@255408 &gt;&gt; Once the refund has been validated and the refund has been transferred to your bank the team will notified you accordingly via email. - Thanks - Anwar,,575470
576310,AirAsiaSupport,FALSE,Sun Dec 03 08:14:24 +0000 2017,"@255408 Hi There :) As per system check, the refund is in process. Please take note that this process may take up to 30 working days and it depends on your bank policy as well. &gt;&gt;&gt;",,575470
577131,AirAsiaSupport,FALSE,Sun Dec 03 09:38:53 +0000 2017,"@255830 We regret for any inconvenience caused, Lahveenya. We would like to know more on yourconcern. Kindly share with us via DM and weâ€™ll provide a swift action on it. Thanks. -Mi",,64949
577132,AirAsiaSupport,FALSE,Sun Dec 03 09:38:09 +0000 2017,"@255831  Hi Pipito, ZGBCVB booking is confirmed, we have resent you the itinerary. Kindly check. Thanks. -Mi",,6412
577133,AirAsiaSupport,FALSE,Sun Dec 03 09:36:02 +0000 2017,@255832 Sincere apologies for the delay in response due to overwhelming feedback from our guest at the moment. Kindly Dm us your booking number and we'll assist further. Thanks. -Mi,577134,64950
577135,AirAsiaSupport,FALSE,Sun Dec 03 09:35:10 +0000 2017,"@255833  &gt;&gt; â€¢ Once expired, it will be forfeited by the system and it is not extendable. 
â€¢ It can be used to make booking for any family members or friends. 

You can make a new booking &gt; proceed to payment page &gt;&gt; select Credit Account to pay the booking
Thanks. Mi",,577136
577137,AirAsiaSupport,FALSE,Sun Dec 03 09:34:52 +0000 2017,"@255833  &gt;&gt;â€¢ Make new bookings, pre-booked meals and baggage 
â€¢ Make changes to an existing bookings, pre-booked meals and baggage 
Also take note that : 
â€¢ The credit shell will be valid for 90 days from date of creation. &gt;&gt;",,577136
577138,AirAsiaSupport,FALSE,Sun Dec 03 09:34:35 +0000 2017,"@255833 Sincere apologies for the delay in response due to overwhelming feedback from our guest at the moment. Would you prefer credit shell option, Credit shell (a.k.a Credit Account) is another payment mode that store in AirAsia member account. You may utilize it to: &gt;&gt;",,577136
577139,AirAsiaSupport,FALSE,Sun Dec 03 09:25:44 +0000 2017,@255834 Hi There :) Oh no! Kindly clear the cache and try to make booking again via website :) See you! - Anwar,,577140
577141,AirAsiaSupport,FALSE,Sun Dec 03 09:20:01 +0000 2017,"@255835 Hi Anton, we have respond to your DM. Thanks. -Mi",,577142
577144,AirAsiaSupport,FALSE,Sun Dec 03 09:18:59 +0000 2017,"@255836 Hi There :) Kindly make refund request via eform https://t.co/yUyvTZDtHT and refund is within 30 working days to payee credit card You'll be notify by email once refund is done :)
See you! â€“ Anwar",577145,577146
577147,AirAsiaSupport,FALSE,Sun Dec 03 09:17:14 +0000 2017,@255837 Hi There :) Can we have the booking number for us to check further? :) See you!- Anwar,,577148
577152,AirAsiaSupport,FALSE,Sun Dec 03 09:16:54 +0000 2017,@255838 Apprecuiate if could tweet in English or do contact our call center support https://t.co/njJjKCd6SV Thanks-Sha,577153,577154
577156,AirAsiaSupport,FALSE,Sun Dec 03 09:14:16 +0000 2017,"@255839 Hi Nakyung, we have respond to your DM. Thanks. -Mi",,577157
577158,AirAsiaSupport,FALSE,Sun Dec 03 09:10:36 +0000 2017,"@255840 Dear Kelly, we had sent you the details via DM, kindly check your inbox. Thanks-Sha",,577159
577160,AirAsiaSupport,FALSE,Sun Dec 03 09:07:24 +0000 2017,@255841 Appreciate if could tweet in English. Kindly refer to our call center https://t.co/njJjKCd6SV Thanks-Sha,,577161
577163,AirAsiaSupport,FALSE,Sun Dec 03 09:06:53 +0000 2017,"@255842 Sincere apologies for the delay in response due to overwhelming feedback from our guest at the moment. Glad to know you have been assisted, relevant team will keep you update via email for the refund status. Thanks. -Mi",,577164
577167,AirAsiaSupport,FALSE,Sun Dec 03 09:02:25 +0000 2017,"@255843 Dear Amit, we had sent you the details via DM, kindly check your inbox. Thanks-Sha",577168,577169
577171,AirAsiaSupport,FALSE,Sun Dec 03 09:00:02 +0000 2017,@255844 Correction done. Please check your mailbox for the revised itinerary. Thank you- Anwar,577172,577173
578196,AirAsiaSupport,FALSE,Sun Dec 03 10:27:44 +0000 2017,"@256102 Sincere apologies for the delay in response due to overwhelming feedback from our guest at the moment. Regret you have selected option to moved flight, unable to opt refund request. Sorry. -Mi",,6201
578197,AirAsiaSupport,FALSE,Sun Dec 03 10:24:54 +0000 2017,"@256103 Hi, we have replied to your DM. Thanks. -Mi",,578198
578199,AirAsiaSupport,FALSE,Sun Dec 03 10:21:56 +0000 2017,@256104 Sincere apologies for the delay in response due to overwhelming feedback from our guest at the moment. Glad to know you have been assisted.Do let us know If any Further assistance is Needed. Thank you and have a Great day. -Mi,,578200
578201,AirAsiaSupport,FALSE,Sun Dec 03 10:18:10 +0000 2017,"@256105  Hi, We regret for any inconvenience caused. We would like to know more on your concern. Kindly share with us via DM and weâ€™ll provide a swift action on it. Thanks. -Mi",,578202
578203,AirAsiaSupport,FALSE,Sun Dec 03 10:10:13 +0000 2017,"@256106 We've resent the itinerary to your email, kindly check your mailbox. Thanks-Sha",,578204
578205,AirAsiaSupport,FALSE,Sun Dec 03 09:46:32 +0000 2017,@256107 Hi There :) We already do move flight as per your request for ZLH5WM to 1820-2205 4 DEC 17 PER-DPS . We hope all is good with you :) See you! - Anwar,,578206
578207,AirAsiaSupport,FALSE,Sun Dec 03 09:43:50 +0000 2017,"@241463 Hi Abdullah, we have respond to your DM. Thanks. -Mi",,521352
579152,AirAsiaSupport,FALSE,Sun Dec 03 11:01:47 +0000 2017,@256360 Hi There :) Can we have the booking number for us to check further? :) See you!- Anwar,,579153
579154,AirAsiaSupport,FALSE,Sun Dec 03 10:58:26 +0000 2017,"@256361 Dear Mackenzie, we had sent you the details via DM, kindly check your inbox. Thanks-Sha",,579155
579156,AirAsiaSupport,FALSE,Sun Dec 03 10:53:26 +0000 2017,"@256362 Dear Agata, we had sent you the details via DM, kindly check your inbox. Thanks-Sha",,579157
579158,AirAsiaSupport,FALSE,Sun Dec 03 10:51:47 +0000 2017,@255211 Hi There :) Sorry for the confusion :( Can we have the booking number for us to check further? :) See you! - Anwar,579159,569348
579160,AirAsiaSupport,FALSE,Sun Dec 03 10:49:47 +0000 2017,"@256363 Sincere apologies for the delay in response due to overwhelming feedback from our guest at the moment. We believe you are referring to JLSU4T KNO-PEN flight, may refer https://t.co/pjTF2ZY1Fz and select (REPRINT). Thanks. -Mi",,579161
579162,AirAsiaSupport,FALSE,Sun Dec 03 10:48:42 +0000 2017,@256364 Hi There :) Can we have the booking number for us to check further? :) See you!- Anwar,,579163
579164,AirAsiaSupport,FALSE,Sun Dec 03 10:48:27 +0000 2017,@256365  Sincere apologies for the delay in response due to overwhelming feedback from our guest at the moment. Kindly DM us your booking number and we'll assist further. Thanks. -Mi,,579165
579166,AirAsiaSupport,FALSE,Sun Dec 03 10:48:07 +0000 2017,@256366 Hi There :) Can we have the correct booking number? or case number? As this booking ENVKQ  is not valid :( As the booking should have 6 alphanumerical number :) See you! - Anwar,579167,579168
